{
  "id": "LES-FLUID-PRESSURE-001",
  "slug": "basic-fluid-pressure",
  "title": "Basic Fluid Pressure",
  "description": "A draft pilot lesson for introductory pressure reasoning using source-linked structured content blocks.",
  "publicationStatus": "draft",
  "reviewStatus": "Engineering review required",
  "version": "0.3.0",
  "estimatedCompletionTime": "25 minutes",
  "difficulty": "Introductory",
  "prerequisites": ["Basic algebra", "SI base and derived units"],
  "knowledgeFileIds": ["KF-FLUID-PRESSURE-001"],
  "sourceIds": ["SRC-OPENSTAX-COLLEGE-PHYSICS-2012", "SRC-PSU-CIMBALA-PRESSURE-BASICS"],
  "learningOutcomes": [
    "Describe pressure as force distributed over area.",
    "Identify the SI units used for pressure, force, and area.",
    "Interpret a simple pressure result within stated educational assumptions."
  ],
  "requiredSections": [
    "lessonHeader",
    "estimatedCompletionTime",
    "difficulty",
    "prerequisites",
    "learningOutcomes",
    "whyTopicMatters",
    "keyTerminology",
    "visualExplanation",
    "theory",
    "equations",
    "workedExamples",
    "interactiveActivity",
    "faultFindingExercise",
    "safetyConsiderations",
    "knowledgeCheck",
    "summary",
    "sources",
    "nextRecommendedLesson"
  ],
  "sections": {
    "lessonHeader": {
      "title": "Lesson header",
      "blocks": [
        {
          "id": "BLK-FP-HEADER-001",
          "type": "paragraph",
          "text": "This pilot lesson introduces pressure as a relationship between normal force and area for an introductory static-fluid context.",
          "sourceIds": [
            "SRC-OPENSTAX-COLLEGE-PHYSICS-2012",
            "SRC-PSU-CIMBALA-PRESSURE-BASICS"
          ]
        }
      ]
    },
    "estimatedCompletionTime": {
      "title": "Estimated completion time",
      "blocks": [
        {
          "id": "BLK-FP-TIME-001",
          "type": "paragraph",
          "text": "Estimated completion time: 25 minutes.",
          "sourceIds": ["SRC-OPENSTAX-COLLEGE-PHYSICS-2012"]
        }
      ]
    },
    "difficulty": {
      "title": "Difficulty",
      "blocks": [
        {
          "id": "BLK-FP-DIFFICULTY-001",
          "type": "paragraph",
          "text": "Difficulty: introductory first-year engineering foundation.",
          "sourceIds": ["SRC-OPENSTAX-COLLEGE-PHYSICS-2012"]
        }
      ]
    },
    "prerequisites": {
      "title": "Prerequisites",
      "blocks": [
        {
          "id": "BLK-FP-PREREQ-001",
          "type": "paragraph",
          "text": "Students should be comfortable with basic algebra and SI units before attempting this lesson.",
          "sourceIds": ["SRC-OPENSTAX-COLLEGE-PHYSICS-2012"]
        }
      ]
    },
    "learningOutcomes": {
      "title": "Learning outcomes",
      "blocks": [
        {
          "id": "BLK-FP-OUTCOME-001",
          "type": "paragraph",
          "text": "By the end of the lesson, students should be able to describe pressure, identify the units Pa, N, and m^2, and interpret a simple result within the stated limitations.",
          "sourceIds": ["SRC-OPENSTAX-COLLEGE-PHYSICS-2012"]
        }
      ]
    },
    "whyTopicMatters": {
      "title": "Why the topic matters",
      "blocks": [
        {
          "id": "BLK-FP-MATTERS-001",
          "type": "engineeringInterpretation",
          "text": "Pressure reasoning is used when engineers compare loads distributed over surfaces, interpret gauge readings, and recognise abnormal pressure conditions in supervised systems.",
          "sourceIds": ["SRC-OPENSTAX-COLLEGE-PHYSICS-2012"]
        }
      ]
    },
    "keyTerminology": {
      "title": "Key terminology",
      "blocks": [
        {
          "id": "BLK-FP-TERM-001",
          "type": "definition",
          "term": "Pressure",
          "definition": "Force distributed over an area in a fluid or on a surface.",
          "sourceIds": [
            "SRC-OPENSTAX-COLLEGE-PHYSICS-2012",
            "SRC-PSU-CIMBALA-PRESSURE-BASICS"
          ]
        }
      ]
    },
    "visualExplanation": {
      "title": "Visual explanation",
      "blocks": [
        {
          "id": "BLK-FP-DIAGRAM-001",
          "type": "diagram",
          "title": "Force distributed over area",
          "altText": "A downward force arrow spreads over a rectangular area, indicating pressure as force divided by area.",
          "description": "Force F acts normally on a surface area A. The larger the area for the same force, the lower the pressure.",
          "caption": "Concept diagram for introductory pressure reasoning.",
          "sourceIds": ["SRC-OPENSTAX-COLLEGE-PHYSICS-2012"]
        }
      ]
    },
    "theory": {
      "title": "Theory",
      "blocks": [
        {
          "id": "BLK-FP-THEORY-001",
          "type": "paragraph",
          "text": "For this introductory lesson, pressure is treated as normal force distributed across a stated area. The calculation is only meaningful when the quantities use consistent SI units.",
          "sourceIds": ["SRC-OPENSTAX-COLLEGE-PHYSICS-2012"]
        },
        {
          "id": "BLK-FP-ASSUMPTION-001",
          "type": "assumption",
          "text": "The force is applied normally over the stated area, and the example is not a pressure-vessel design case.",
          "sourceIds": ["SRC-OPENSTAX-COLLEGE-PHYSICS-2012"]
        }
      ]
    },
    "equations": {
      "title": "Equations",
      "blocks": [
        {
          "id": "EQ-FLUID-PRESSURE-001",
          "type": "equation",
          "name": "Pressure from force and area",
          "expression": "p = F / A",
          "symbols": [
            { "symbol": "p", "name": "pressure", "unit": "Pa" },
            { "symbol": "F", "name": "force", "unit": "N" },
            { "symbol": "A", "name": "area", "unit": "m^2" }
          ],
          "sourceIds": [
            "SRC-OPENSTAX-COLLEGE-PHYSICS-2012",
            "SRC-PSU-CIMBALA-PRESSURE-BASICS"
          ]
        },
        {
          "id": "BLK-FP-SYMBOLS-001",
          "type": "symbolTable",
          "symbols": [
            { "symbol": "p", "name": "pressure", "unit": "Pa" },
            { "symbol": "F", "name": "force", "unit": "N" },
            { "symbol": "A", "name": "area", "unit": "m^2" }
          ],
          "sourceIds": ["SRC-OPENSTAX-COLLEGE-PHYSICS-2012"]
        },
        {
          "id": "BLK-FP-UNIT-001",
          "type": "unitNote",
          "quantity": "pressure",
          "siUnit": "Pa",
          "note": "Industrial Learn calculations store force in newtons, area in square metres, and pressure in pascals internally.",
          "sourceIds": [
            "SRC-OPENSTAX-COLLEGE-PHYSICS-2012",
            "SRC-PSU-CIMBALA-PRESSURE-BASICS"
          ]
        }
      ]
    },
    "workedExamples": {
      "title": "Worked examples",
      "blocks": [
        {
          "id": "WE-FLUID-PRESSURE-001",
          "type": "workedCalculation",
          "title": "Pressure from a known force and area",
          "given": ["Force F = 200 N", "Area A = 0.50 m^2"],
          "steps": [
            {
              "label": "Check units",
              "expression": "F in N, A in m^2",
              "explanation": "Both quantities are already in the SI units used internally."
            },
            {
              "label": "Substitute values",
              "expression": "p = 200 / 0.50",
              "explanation": "Use the source-linked pressure relationship from the equation block."
            },
            {
              "label": "Calculate pressure",
              "expression": "p = 400 Pa",
              "explanation": "The pressure is expressed in pascals."
            }
          ],
          "result": "400 Pa",
          "interpretation": "A pressure of 400 Pa is the result for this educational example under the stated assumptions.",
          "sourceIds": ["SRC-OPENSTAX-COLLEGE-PHYSICS-2012"]
        }
      ]
    },
    "interactiveActivity": {
      "title": "Interactive activity or simulation",
      "blocks": [
        {
          "id": "BLK-FP-ACTIVITY-001",
          "type": "paragraph",
          "text": "Simulation placeholder: adjust force and area in a future activity to observe pressure changes. No simulation state is implemented in this pilot lesson.",
          "sourceIds": ["SRC-OPENSTAX-COLLEGE-PHYSICS-2012"]
        }
      ]
    },
    "faultFindingExercise": {
      "title": "Fault-finding exercise",
      "blocks": [
        {
          "id": "FAULT-FLUID-PRESSURE-001",
          "type": "faultCase",
          "title": "Unexpected pressure reading",
          "symptoms": ["The reading is outside the expected training range."],
          "likelyCauses": [
            "Incorrect area input",
            "Incorrect unit conversion",
            "Sensor or gauge issue in a real system"
          ],
          "safeResponse": "Treat real-system abnormal pressure as a safety concern and follow supervised laboratory or site procedures.",
          "sourceIds": ["SRC-OPENSTAX-COLLEGE-PHYSICS-2012"]
        }
      ]
    },
    "safetyConsiderations": {
      "title": "Safety considerations",
      "blocks": [
        {
          "id": "SAFE-FLUID-PRESSURE-001",
          "type": "warning",
          "severity": "warning",
          "title": "Stored pressure",
          "text": "Real pressurised systems can be hazardous. This lesson does not authorise students to inspect, open, adjust, or operate pressurised equipment.",
          "sourceIds": ["SRC-OPENSTAX-COLLEGE-PHYSICS-2012"]
        }
      ]
    },
    "knowledgeCheck": {
      "title": "Knowledge check",
      "blocks": [
        {
          "id": "QUIZ-FLUID-PRESSURE-001",
          "type": "question",
          "prompt": "Which SI units should be used internally for the introductory pressure calculation in this lesson?",
          "options": [
            {
              "id": "A",
              "text": "newtons, square metres, and pascals",